{
  "name": "sap-fiori-tools",
  "version": "2.4.0",
  "description": "Develops SAP Fiori applications using SAP Fiori tools extensions for VS Code and SAP Business Application Studio. Use when: generating Fiori Elements or Freestyle SAPUI5 applications, configuring Page Editor for List Report or Object Page, working with annotations and Service Modeler, setting up deployment to ABAP or Cloud Foundry, creating adaptation projects, using Guided Development, previewing with mock data or live data, configuring SAP Fiori launchpad, or using AI-powered generation with Project Accelerator/Joule. Technologies: SAP Fiori Elements, SAPUI5, OData V2/V4, CAP, SAP BTP, ABAP, Cloud Foundry, fiori-mcp-server (MCP tools for AI-assisted generation).",
  "author": {
    "name": "Eduard Jiglau",
    "email": "hello@sap-ai-skills.com",
    "url": "https://sap-ai-skills.com"
  },
  "homepage": "https://sap-ai-skills.com",
  "repository": "https://github.com/secondsky/sap-skills",
  "license": "GPL-3.0",
  "keywords": [
    "abap",
    "btp",
    "cap",
    "cloud foundry",
    "components",
    "deployment",
    "fiori",
    "frontend",
    "mvc",
    "odata",
    "sap",
    "sap-fiori-tools",
    "sapui5",
    "tools"
  ],
  "skills": "./skills/",
  "interface": {
    "displayName": "SAP Fiori Tools",
    "shortDescription": "Develops SAP Fiori applications using SAP Fiori tools extensi...",
    "longDescription": "Develops SAP Fiori applications using SAP Fiori tools extensions for VS Code and SAP Business Application Studio. Use when: generating Fiori Elements or Freestyle SAPUI5 applications, configuring Page Editor for List Report or Object Page, working with annotations and Service Modeler, setting up deployment to ABAP or Cloud Foundry, creating adaptation projects, using Guided Development, previewing with mock data or live data, configuring SAP Fiori launchpad, or using AI-powered generation with Project Accelerator/Joule. Technologies: SAP Fiori Elements, SAPUI5, OData V2/V4, CAP, SAP BTP, ABAP, Cloud Foundry, fiori-mcp-server (MCP tools for AI-assisted generation).",
    "developerName": "Eduard Jiglau",
    "category": "UI Development",
    "capabilities": [
      "Interactive",
      "Read",
      "Write"
    ],
    "defaultPrompt": [
      "Use SAP Fiori Tools for SAP guidance."
    ],
    "websiteURL": "https://sap-ai-skills.com"
  }
}
