{
  "name": "sap-btp-integration-suite",
  "version": "2.4.0",
  "description": "Enterprise integration solutions using SAP Integration Suite on BTP. Covers Cloud Integration (iFlows), API Management, Event Mesh, Edge Integration Cell, Integration Advisor, Trading Partner Management, and Migration Assessment. Use for building integration flows, managing API proxies, event-driven architectures, B2B/EDI integrations, hybrid deployments, adapter configuration, Groovy/JavaScript message processing, and troubleshooting.",
  "author": {
    "name": "Eduard Jiglau",
    "email": "hello@sap-ai-skills.com",
    "url": "https://sap-ai-skills.com"
  },
  "homepage": "https://sap-ai-skills.com",
  "repository": "https://github.com/secondsky/sap-skills",
  "license": "GPL-3.0",
  "keywords": [
    "api",
    "btp",
    "cloud foundry",
    "cloud platform",
    "deployment",
    "edge",
    "integration",
    "javascript",
    "kyma",
    "migration",
    "sap",
    "sap-btp-integration-suite",
    "suite"
  ],
  "skills": "./skills/",
  "interface": {
    "displayName": "SAP BTP Integration Suite",
    "shortDescription": "Enterprise integration solutions using SAP Integration Suite...",
    "longDescription": "Enterprise integration solutions using SAP Integration Suite on BTP. Covers Cloud Integration (iFlows), API Management, Event Mesh, Edge Integration Cell, Integration Advisor, Trading Partner Management, and Migration Assessment. Use for building integration flows, managing API proxies, event-driven architectures, B2B/EDI integrations, hybrid deployments, adapter configuration, Groovy/JavaScript message processing, and troubleshooting.",
    "developerName": "Eduard Jiglau",
    "category": "BTP",
    "capabilities": [
      "Interactive",
      "Read",
      "Write"
    ],
    "defaultPrompt": [
      "Use SAP BTP Integration Suite for SAP guidance."
    ],
    "websiteURL": "https://sap-ai-skills.com"
  }
}
