{
  "name": "sap-btp-business-application-studio",
  "version": "2.4.0",
  "description": "This skill provides comprehensive guidance for SAP Business Application Studio (BAS), the cloud-based IDE on SAP BTP built on Code-OSS. Use when setting up BAS subscriptions, creating dev spaces, connecting to external systems, deploying MTA applications, troubleshooting connectivity issues, managing Git repositories, configuring runtime versions, or using the layout editor. Keywords: SAP Business Application Studio, BAS, SAP BTP, dev space, Cloud Foundry, MTA, multitarget application, SAP Fiori, CAP, HANA, destination, WebIDEEnabled, Cloud Connector, Service Center, Storyboard, Layout Editor, ABAP, OData, subscription, entitlements, role collection, Business_Application_Studio_Developer, Git, clone, push, pull, Gerrit, PAT, OAuth, asdf, runtime, Node.js, Java, Python, Task Explorer, CI/CD, Yeoman, generator, template wizard, mbt, mtar, debugging, breakpoint",
  "author": {
    "name": "Eduard Jiglau",
    "email": "hello@sap-ai-skills.com",
    "url": "https://sap-ai-skills.com"
  },
  "homepage": "https://sap-ai-skills.com",
  "repository": "https://github.com/secondsky/sap-skills",
  "license": "GPL-3.0",
  "keywords": [
    "abap",
    "application",
    "btp",
    "business",
    "cap",
    "cloud foundry",
    "cloud platform",
    "fiori",
    "hana",
    "java",
    "kyma",
    "node.js",
    "oauth",
    "odata",
    "python",
    "sap",
    "sap-btp-business-application-studio",
    "studio"
  ],
  "skills": "./skills/",
  "interface": {
    "displayName": "SAP BTP Business Application Studio",
    "shortDescription": "This skill provides comprehensive guidance for SAP Business A...",
    "longDescription": "This skill provides comprehensive guidance for SAP Business Application Studio (BAS), the cloud-based IDE on SAP BTP built on Code-OSS. Use when setting up BAS subscriptions, creating dev spaces, connecting to external systems, deploying MTA applications, troubleshooting connectivity issues, managing Git repositories, configuring runtime versions, or using the layout editor. Keywords: SAP Business Application Studio, BAS, SAP BTP, dev space, Cloud Foundry, MTA, multitarget application, SAP Fiori, CAP, HANA, destination, WebIDEEnabled, Cloud Connector, Service Center, Storyboard, Layout Editor, ABAP, OData, subscription, entitlements, role collection, Business_Application_Studio_Developer, Git, clone, push, pull, Gerrit, PAT, OAuth, asdf, runtime, Node.js, Java, Python, Task Explorer, CI/CD, Yeoman, generator, template wizard, mbt, mtar, debugging, breakpoint",
    "developerName": "Eduard Jiglau",
    "category": "BTP",
    "capabilities": [
      "Interactive",
      "Read",
      "Write"
    ],
    "defaultPrompt": [
      "Use SAP BTP Business Application Studio for SAP guidance."
    ],
    "websiteURL": "https://sap-ai-skills.com"
  }
}
