{
  "name": "sapui5-cli",
  "version": "2.4.0",
  "description": "Manages SAPUI5/OpenUI5 projects using the UI5 Tooling CLI (@ui5/cli). Use when initializing UI5 projects, configuring ui5.yaml or ui5-workspace.yaml files, building UI5 applications or libraries, running development servers with HTTP/2 support, creating custom build tasks or server middleware, managing workspace/monorepo setups, troubleshooting UI5 CLI errors, migrating between UI5 CLI versions, or optimizing build performance. Supports both OpenUI5 and SAPUI5 frameworks with complete configuration and extensibility guidance.",
  "author": {
    "name": "Eduard Jiglau",
    "email": "hello@sap-ai-skills.com",
    "url": "https://sap-ai-skills.com"
  },
  "homepage": "https://sap-ai-skills.com",
  "repository": "https://github.com/secondsky/sap-skills",
  "license": "GPL-3.0",
  "keywords": [
    "cli",
    "components",
    "fiori",
    "frontend",
    "http",
    "mvc",
    "sapui5",
    "sapui5-cli",
    "yaml"
  ],
  "skills": "./skills/",
  "interface": {
    "displayName": "Sapui5 CLI",
    "shortDescription": "Manages SAPUI5/OpenUI5 projects using the UI5 Tooling CLI (@u...",
    "longDescription": "Manages SAPUI5/OpenUI5 projects using the UI5 Tooling CLI (@ui5/cli). Use when initializing UI5 projects, configuring ui5.yaml or ui5-workspace.yaml files, building UI5 applications or libraries, running development servers with HTTP/2 support, creating custom build tasks or server middleware, managing workspace/monorepo setups, troubleshooting UI5 CLI errors, migrating between UI5 CLI versions, or optimizing build performance. Supports both OpenUI5 and SAPUI5 frameworks with complete configuration and extensibility guidance.",
    "developerName": "Eduard Jiglau",
    "category": "UI Development",
    "capabilities": [
      "Interactive",
      "Read",
      "Write"
    ],
    "defaultPrompt": [
      "Use Sapui5 CLI for SAP guidance."
    ],
    "websiteURL": "https://sap-ai-skills.com"
  }
}
